Category,Certification_Name,Provider,URL,Description,Duration,Level,Prerequisites,Expiration
AI & Machine Learning Engineering,AI for Everyone,DeepLearning.AI (Coursera),https://www.coursera.org/learn/ai-for-everyone,"AI concepts, business applications, and societal impact.",4 weeks (2-3 hrs/week),Beginner,,Never
AI & Machine Learning Engineering,"AdvancedGuided ProjectLight Graph Convolutional Network for Recommender SystemsArtificial Intelligence, Bayesian Personalized Ranking (BPR), Bipartite Graph, +3 more34 Enrolled60 Minutes4.9(7 Reviews)",IBM,https://cognitiveclass.ai/courses/course-v1:IBMSkillsNetwork+GPXX0H9SEN+v1,Free certification from IBM,Self-paced,Beginner,,
AI & Machine Learning Engineering,"BeginnerCourseA Quick Introduction to Machine LearningArtificial Intelligence, Data Science, Machine Learning, +1 more14k+ Enrolled3 Hours4.6(3.93k+ Reviews)",IBM,https://cognitiveclass.ai/courses/course-v1:IBMSkillsNetwork+ML0104EN+v1,Free certification from IBM,Self-paced,Beginner,,
AI & Machine Learning Engineering,BeginnerCourseBig Data 101Big Data60.1k+ Enrolled3 Hours4.7(10.4k+ Reviews),IBM,https://cognitiveclass.ai/courses/course-v1:CognitiveClass+BD0101EN+v2,Free certification from IBM,Self-paced,Beginner,,
AI & Machine Learning Engineering,"BeginnerCourseBuild Your Own ChatbotArtificial Intelligence, Chatbots, NLP44.2k+ Enrolled5 Hours4.6(4.6k+ Reviews)",IBM,https://cognitiveclass.ai/courses/course-v1:IBMDeveloperSkillsNetwork+CB0101EN+v1,Free certification from IBM,Self-paced,Beginner,,
AI & Machine Learning Engineering,"BeginnerCourseBuilding AI Powered Chatbots Without ProgrammingArtificial Intelligence, Chatbots, NLP28.9k+ Enrolled6 Weeks4.7(3.78k+ Reviews)",IBM,https://cognitiveclass.ai/courses/course-v1:IBMSkillsNetwork+CB0103EN+v1_Coursera,Free certification from IBM,Self-paced,Beginner,,
AI & Machine Learning Engineering,"BeginnerCourseData Analysis with PythonData Analysis, Data Science, Numpy, +3 more129k+ Enrolled15 Hours4.7(14.7k+ Reviews)",IBM,https://cognitiveclass.ai/courses/course-v1:CognitiveClass+DA0101EN+v2,Free certification from IBM,Self-paced,Beginner,,
AI & Machine Learning Engineering,BeginnerCourseData Science 101Data Science93.3k+ Enrolled11 Hours4.6(16.4k+ Reviews),IBM,https://cognitiveclass.ai/courses/course-v1:BigDataUniversity+DS0101EN+v1,Free certification from IBM,Self-paced,Beginner,,
AI & Machine Learning Engineering,BeginnerCourseData Science Methodologyplaceholder109k+ Enrolled4 Hour4.6(5.32k+ Reviews),IBM,https://cognitiveclass.ai/courses/course-v1:CognitiveClass+DS0103EN+v3,Free certification from IBM,Self-paced,Beginner,,
AI & Machine Learning Engineering,BeginnerCourseData Science Toolsplaceholder40.6k+ Enrolled15 Hours4.5(3.97k+ Reviews),IBM,https://cognitiveclass.ai/courses/course-v1:CognitiveClass+DS0105EN+v3,Free certification from IBM,Self-paced,Beginner,,
AI & Machine Learning Engineering,"BeginnerCourseData Visualization with PythonData Science, Data Visualization, Python53.7k+ Enrolled10 Hours4.6(7.2k+ Reviews)",IBM,https://cognitiveclass.ai/courses/course-v1:CognitiveClass+DV0101EN+v2,Free certification from IBM,Self-paced,Beginner,,
AI & Machine Learning Engineering,BeginnerCourseDeep Learning with TensorFlowplaceholder20.1k+ Enrolled3 Hours4.6(2.04k+ Reviews),IBM,https://cognitiveclass.ai/courses/course-v1:BigDataUniversity+ML0120EN+v2,Free certification from IBM,Self-paced,Beginner,,
AI & Machine Learning Engineering,"BeginnerCourseDocker Essentials: A Developer IntroductionContainers, Docker108k+ Enrolled3 Hours4.6(4.99k+ Reviews)",IBM,https://cognitiveclass.ai/courses/course-v1:IBMDeveloperSkillsNetwork+CO0101EN+v1,Free certification from IBM,Self-paced,Beginner,,
AI & Machine Learning Engineering,"BeginnerCourseGetting Started with Git and GitHubGit, GitHub, Software Engineering, +1 more69.9k+ Enrolled7 Hours4.6(1.91k+ Reviews)",IBM,https://cognitiveclass.ai/courses/course-v1:IBMSkillsNetwork+CD0131EN+v1_Coursera,Free certification from IBM,Self-paced,Beginner,,
AI & Machine Learning Engineering,"BeginnerCourseHadoop 101Apache Spark, Big Data26.8k+ Enrolled20 Hours4.5(4.06k+ Reviews)",IBM,https://cognitiveclass.ai/courses/course-v1:BigDataUniversity+BD0111EN+v1,Free certification from IBM,Self-paced,Beginner,,
AI & Machine Learning Engineering,"BeginnerCourseHands-on Introduction to Linux Commands and Shell ScriptingBash (Unix Shell), Linux, Operating Systems, +3 more70k+ Enrolled14 Hours4.6(1.74k+ Reviews)",IBM,https://cognitiveclass.ai/courses/course-v1:IBMSkillsNetwork+LX0117EN+v1_Coursera,Free certification from IBM,Self-paced,Beginner,,
AI & Machine Learning Engineering,"BeginnerCourseIBM Cloud EssentialsCloud, Monitoring, Security49.2k+ Enrolled8 Hours4.7(5k+ Reviews)",IBM,https://cognitiveclass.ai/courses/course-v1:IBMDeveloperSkillsNetwork+CC0103EN+v3,Free certification from IBM,Self-paced,Beginner,,
AI & Machine Learning Engineering,BeginnerCourseIntroducing AIArtificial Intelligence32.1k+ Enrolled1 Hour4.6(12.2k+ Reviews),IBM,https://cognitiveclass.ai/courses/course-v1:IBMSkillsNetwork+AI0105EN+v1,Free certification from IBM,Self-paced,Beginner,,
AI & Machine Learning Engineering,"BeginnerCourseIntroduction to Agentic AIAgentic AI, AI Agent, Artificial Intelligence, +2 more8.95k+ Enrolled3 Hours4.8(4.72k+ Reviews)",IBM,https://cognitiveclass.ai/courses/course-v1:IBMSkillsNetwork+AI0146EN+v1,Free certification from IBM,Self-paced,Beginner,,
AI & Machine Learning Engineering,"BeginnerCourseIntroduction to Agile Development and ScrumAgile Software Development, Kanban, Scrum Methodology, +2 more67.1k+ Enrolled11 Hours4.8(2.7k+ Reviews)",IBM,https://cognitiveclass.ai/courses/course-v1:IBMSkillsNetwork+CD0116EN+v1_Coursera,Free certification from IBM,Self-paced,Beginner,,
AI & Machine Learning Engineering,"BeginnerCourseIntroduction to Cloud ComputingCloud Applications, Cloud Computing, Cloud Computing Security, +2 more105k+ Enrolled12 Hours4.6(7.71k+ Reviews)",IBM,https://cognitiveclass.ai/courses/course-v1:IBMSkillsNetwork+CC0101EN+v1_Coursera,Free certification from IBM,Self-paced,Beginner,,
AI & Machine Learning Engineering,BeginnerCourseIntroduction to CloudCloud Computing103k+ Enrolled6 Hours4.6(9.97k+ Reviews),IBM,https://cognitiveclass.ai/courses/course-v1:IBMDeveloperSkillsNetwork+CC0101EN+v1,Free certification from IBM,Self-paced,Beginner,,
AI & Machine Learning Engineering,"BeginnerCourseIntroduction to DevOpsAgile, Behavior Driven Development, Continuous Delivery, +3 more17.6k+ Enrolled9 Hours4.8(4.08k+ Reviews)",IBM,https://cognitiveclass.ai/courses/course-v1:IBMSkillsNetwork+CD0115EN+v1_Coursera,Free certification from IBM,Self-paced,Beginner,,
AI & Machine Learning Engineering,"BeginnerCourseMachine Learning with PythonMachine Learning, Python125k+ Enrolled20 Hours4.7(10.9k+ Reviews)",IBM,https://cognitiveclass.ai/courses/course-v1:BDU+ML0101EN+v4,Free certification from IBM,Self-paced,Beginner,,
AI & Machine Learning Engineering,"BeginnerCoursePrompt Engineering for EveryoneArtificial Intelligence, Generative AI, LLM, +1 more103k+ Enrolled5 Hours4.7(22.4k+ Reviews)",IBM,https://cognitiveclass.ai/courses/course-v1:IBMSkillsNetwork+AI0117EN+v1,Free certification from IBM,Self-paced,Beginner,,
AI & Machine Learning Engineering,"BeginnerCoursePython for Data Science, AI & DevelopmentData Analysis, Data Structures, Numpy, +3 more19.5k+ Enrolled26 Hours4.6(43.3k+ Reviews)",IBM,https://cognitiveclass.ai/courses/course-v1:IBMSkillsNetwork+PY0101EN+v1_Coursera,Free certification from IBM,Self-paced,Beginner,,
AI & Machine Learning Engineering,"BeginnerCoursePython for Data ScienceData Science, Python548k+ Enrolled18 Hours4.7(54.3k+ Reviews)",IBM,https://cognitiveclass.ai/courses/course-v1:CognitiveClass+PY0101EN+v3,Free certification from IBM,Self-paced,Beginner,,
AI & Machine Learning Engineering,"BeginnerCourseR for Data ScienceData Analysis, Data Science, Data Visualization, +1 more25k+ Enrolled6 Hours4.7(2.49k+ Reviews)",IBM,https://cognitiveclass.ai/courses/course-v1:CognitiveClass+RP0101EN+v1,Free certification from IBM,Self-paced,Beginner,,
AI & Machine Learning Engineering,"BeginnerCourseSQL and Relational Databases 101Databases, SQL166k+ Enrolled3 Hours4.7(18.2k+ Reviews)",IBM,https://cognitiveclass.ai/courses/course-v1:BDU+DB0101EN+v1,Free certification from IBM,Self-paced,Beginner,,
AI & Machine Learning Engineering,"BeginnerGuided ProjectAI Code Review Showdown: Anthropic's Claude vs IBM's GraniteArtificial Intelligence, Generative AI, Granite, +3 more141 Enrolled30 Minutes4.8(20 Reviews)",IBM,https://cognitiveclass.ai/courses/course-v1:IND+GPXX0LVJEN+v1,Free certification from IBM,Self-paced,Beginner,,
AI & Machine Learning Engineering,"BeginnerGuided ProjectBuild Multi-Agent Santa Quiz Game w/ Granite, CrewAI, GradioArtificial Intelligence, CrewAI, Gradio, +3 more311 Enrolled45 Mins4.8(33 Reviews)",IBM,https://cognitiveclass.ai/courses/course-v1:IBMSkillsNetwork+GPXX05VOEN+v1,Free certification from IBM,Self-paced,Beginner,,
AI & Machine Learning Engineering,"BeginnerGuided ProjectMultilingual AI Agents for Poetry using GPT-5 & AutoGen/AG2AI Agent, Artificial Intelligence, Autogen, +3 more644 Enrolled35 Minutes4.8(72 Reviews)",IBM,https://cognitiveclass.ai/courses/course-v1:IBMSkillsNetwork+GPXX0EGKEN+v1,Free certification from IBM,Self-paced,Beginner,,
AI & Machine Learning Engineering,"BeginnerGuided ProjectOptimize Models with Optuna: Adaptive Hyperparameter TuningHyperparameter Tuning, Machine Learning, Optimization90 Enrolled20 Mins4.8(22 Reviews)",IBM,https://cognitiveclass.ai/courses/course-v1:IBMSkillsNetwork+GPXX05RFEN+v1,Free certification from IBM,Self-paced,Beginner,,
AI & Machine Learning Engineering,"CourseDeep Learning FundamentalsData Science, Machine Learning, Deep Learning95k+ Enrolled3 Hours4.63(1.68k+ Reviews)",IBM,https://cognitiveclass.ai/courses/course-v1:DeepLearning.TV+ML0115EN+v2.0,Free certification from IBM,Self-paced,Beginner,,
AI & Machine Learning Engineering,"IntermediateCourseIntroduction to Containers, Kubernetes, and OpenShiftCloud38k+ Enrolled18 Hours4.6(1.93k+ Reviews)",IBM,https://cognitiveclass.ai/courses/course-v1:IBMDeveloperSkillsNetwork+CC0201EN+v1,Free certification from IBM,Self-paced,Beginner,,
AI & Machine Learning Engineering,"IntermediateCourseSpark Fundamentals IApache Spark, Big Data26.2k+ Enrolled4 Hours4.4(2.88k+ Reviews)",IBM,https://cognitiveclass.ai/courses/course-v1:BigDataUniversity+BD0211EN+v1,Free certification from IBM,Self-paced,Beginner,,
AI & Machine Learning Engineering,"IntermediateGuided ProjectAgentic Graph-RAG Over Social-Network Knowledge GraphsAI Agents, Graph Neural Networks (GNNs), Knowledge Graphs, +3 more112 Enrolled60 Minutes4.7(14 Reviews)",IBM,https://cognitiveclass.ai/courses/course-v1:IBMSkillsNetwork+GPXX0B3MEN+v1,Free certification from IBM,Self-paced,Beginner,,
AI & Machine Learning Engineering,"IntermediateGuided ProjectBuild Your Interview Coach with Llama, OpenAI Whisper & TTSAI Agents, Generative AI, Gradio, +3 more168 Enrolled45 Minutes4.6(20 Reviews)",IBM,https://cognitiveclass.ai/courses/course-v1:IBMSkillsNetwork+GPXX0IMIEN+v1,Free certification from IBM,Self-paced,Beginner,,
AI & Machine Learning Engineering,"IntermediateGuided ProjectMulti-Agent Restaurant Chatbot with Vision LLM, CrewAI & RAGAI Agents, CrewAI, Multi-Agent Systems, +3 more344 Enrolled1 Hr + 45 Mins4.7(24 Reviews)",IBM,https://cognitiveclass.ai/courses/course-v1:IBMSkillsNetwork+GPXX0RK7EN+v1,Free certification from IBM,Self-paced,Beginner,,
AI & Machine Learning Engineering,Machine Learning Crash Course,Google,https://developers.google.com/machine-learning/crash-course,Hands-on introduction to machine learning concepts and model training.,15 hours,Beginner,Python basics,Never
AI & Machine Learning Engineering,Natural Language Processing with Classification and Vector Spaces,DeepLearning.AI (Coursera),https://www.coursera.org/learn/classification-vector-spaces-in-nlp,"NLP fundamentals, tokenization, and vector spaces.",4 weeks (3-5 hrs/week),Intermediate,"Python, ML basics",Never
AI & Machine Learning Engineering,"NewBeginnerGuided ProjectBuild a Dating Match Prediction Agent w/ ReAct and LangGraphAgentic AI, Applied Machine Learning, Data Mining, +3 more2 Enrolled45 Minutes5.0(1 Review)",IBM,https://cognitiveclass.ai/courses/course-v1:IBMSkillsNetwork+GPXX03MREN+v1,Free certification from IBM,Self-paced,Beginner,,
AI & Machine Learning Engineering,"NewBeginnerGuided ProjectBuild a Lunar New Year Game with CrewAI Multi-Agent SystemAgentic AI, AI Agents, Artificial Intelligence, +3 more14 Enrolled50 Minutes3.0(1 Review)",IBM,https://cognitiveclass.ai/courses/course-v1:IBMSkillsNetwork+GPXX0RAIEN+v1,Free certification from IBM,Self-paced,Beginner,,
AI & Machine Learning Engineering,"NewBeginnerGuided ProjectDiscover Patterns in MMA with Python, Pandas, and StatisticsData Visualization, General Statistics, Matplotlib, +3 more3 Enrolled30 Minutes5.0(1 Review)",IBM,https://cognitiveclass.ai/courses/course-v1:IND+GPXX01KREN+v1,Free certification from IBM,Self-paced,Beginner,,
AI & Machine Learning Engineering,"NewBeginnerGuided ProjectEvaluation of Fixed-Length and Semantic Chunking in RAGFaiss, Retrieval-Augmented Generation (RAG), Sentence Embeddings, +3 more31 Enrolled60 Minutes4.0(1 Review)",IBM,https://cognitiveclass.ai/courses/course-v1:IBMSkillsNetwork+GPXX08VEEN+v1,Free certification from IBM,Self-paced,Beginner,,
AI & Machine Learning Engineering,"NewIntermediateCourseIntroduction to Test and Behavior Driven DevelopmentAutomated Testing, Behavior Driven Development, Software Testing, +1 more1 Enrolled19 Hours4.8(243 Reviews)",IBM,https://cognitiveclass.ai/courses/course-v1:IBMSkillsNetwork+CD0241EN+v1_Coursera,Free certification from IBM,Self-paced,Beginner,,
AI & Machine Learning Engineering,"NewIntermediateGuided ProjectBuild a Deep Research Agent with LangGraphAgentic AI, AI, AI Agents, +3 more23 Enrolled90 Minutes5.0(1 Review)",IBM,https://cognitiveclass.ai/courses/course-v1:IBMSkillsNetwork+GPXX0DNGEN+v1,Free certification from IBM,Self-paced,Beginner,,
AI & Machine Learning Engineering,"NewIntermediateGuided ProjectSynthetic Dataset Generation with LLM Agent and StatisticsAI, Data Engineering, Data Science, +3 more4 Enrolled90 Minutes5.0(1 Review)",IBM,https://cognitiveclass.ai/courses/course-v1:IBMSkillsNetwork+GPXX0XX5EN+v1,Free certification from IBM,Self-paced,Beginner,,
AI & Machine Learning Engineering,OpenMined Privacy in AI,OpenMined,https://courses.openmined.org/,Privacy-preserving machine learning and federated learning.,Self-paced,Intermediate,ML basics,Never
AI & Machine Learning Engineering,Practical Deep Learning for Coders,fast.ai,https://course.fast.ai/,Deep learning model training and deployment.,7 weeks (10 hrs/week),Intermediate,"Python, basic ML",Never
AI & Machine Learning Engineering,Prompt Engineering for ChatGPT,Vanderbilt University (Coursera),https://www.coursera.org/learn/prompt-engineering,Prompt engineering techniques for LLMs and generative AI.,3 weeks (2-3 hrs/week),Beginner,,Never
Aerospace Engineering,Aircraft Structures,NPTEL (IIT Bombay),https://nptel.ac.in/courses/101101002,Analysis and design of aircraft structures.,Self-paced,Intermediate,Mechanics of Materials,Never
Aerospace Engineering,Aircraft Systems Engineering,MIT OpenCourseWare,https://ocw.mit.edu/courses/aeronautics-and-astronautics/16-885j-aircraft-systems-engineering-fall-2005/,Aircraft systems design and integration.,Self-paced,Advanced,Basic Aerospace,Never
Aerospace Engineering,Computational Fluid Dynamics,NPTEL (IIT Bombay),https://nptel.ac.in/courses/101101058,CFD methods in aerospace applications.,Self-paced,Advanced,"Fluid Mechanics, Programming",Never
Aerospace Engineering,Flight Mechanics,NPTEL (IIT Kanpur),https://nptel.ac.in/courses/101104018,Aircraft flight dynamics and control.,Self-paced,Intermediate,Dynamics,Never
Aerospace Engineering,Introduction to Aerospace Engineering,MIT OpenCourseWare,https://ocw.mit.edu/courses/aeronautics-and-astronautics/16-00-introduction-to-aerospace-engineering-and-design-spring-2003/,Fundamentals of aerospace engineering and design.,Self-paced,Beginner,"Physics, Calculus",Never
Aerospace Engineering,Space Systems Engineering,MIT OpenCourseWare,https://ocw.mit.edu/courses/aeronautics-and-astronautics/16-851-satellite-engineering-fall-2003/,Satellite and space systems design.,Self-paced,Advanced,Basic Aerospace,Never
Aerospace Engineering,Spacecraft Dynamics,MIT OpenCourseWare,https://ocw.mit.edu/courses/aeronautics-and-astronautics/16-346-astrodynamics-fall-2008/,Orbital mechanics and spacecraft dynamics.,Self-paced,Advanced,"Dynamics, Calculus",Never
Arts & Humanities,Ancient Greek History,Yale University (Coursera),https://www.coursera.org/learn/ancient-greeks,Introduction to ancient Greek civilization and history.,8 weeks (3-4 hrs/week),Beginner,,Never
Arts & Humanities,Art History Basics,Khan Academy,https://www.khanacademy.org/humanities/art-history,Introduction to art history and appreciation.,Self-paced,Beginner,,Never
Arts & Humanities,Classical Music Appreciation,Yale University (Coursera),https://www.coursera.org/learn/introclassicalmusic,Introduction to classical music and its history.,9 weeks (2-3 hrs/week),Beginner,,Never
Arts & Humanities,Contemporary Art,MoMA (Coursera),https://www.coursera.org/learn/contemporary-art,Study of contemporary art movements and artists.,6 weeks (2-3 hrs/week),Beginner,,Never
Arts & Humanities,Creative Writing,University of Michigan (Coursera),https://www.coursera.org/specializations/creative-writing,Creative writing techniques and storytelling.,6 weeks (3-4 hrs/week),Beginner,,Never
Arts & Humanities,Cultural Anthropology,MIT OpenCourseWare,https://ocw.mit.edu/courses/anthropology/,Introduction to cultural anthropology concepts.,Self-paced,Beginner,,Never
Arts & Humanities,Digital Photography,Harvard University (edX),https://www.edx.org/course/digital-photography,Principles of digital photography and visual arts.,4 weeks (3-4 hrs/week),Beginner,,Never
Arts & Humanities,Introduction to Philosophy,University of Edinburgh (Coursera),https://www.coursera.org/learn/philosophy,Fundamental concepts and theories in philosophy.,7 weeks (2-4 hrs/week),Beginner,,Never
Arts & Humanities,Modern Art & Ideas,MoMA (Coursera),https://www.coursera.org/learn/modern-art-ideas,Introduction to modern art history and concepts.,6 weeks (2-3 hrs/week),Beginner,,Never
Arts & Humanities,Modern Poetry,University of Pennsylvania (Coursera),https://www.coursera.org/learn/modpo,Study of modern and contemporary poetry.,10 weeks (4-6 hrs/week),Intermediate,,Never
Arts & Humanities,Music Theory Fundamentals,Berklee College of Music (Coursera),https://www.coursera.org/learn/music-theory,Basic music theory and composition concepts.,6 weeks (4-5 hrs/week),Beginner,,Never
Arts & Humanities,Shakespeare Studies,University of London (Coursera),https://www.coursera.org/learn/shakespeare,Study of Shakespeare's works and their context.,6 weeks (3-4 hrs/week),Intermediate,,Never
Arts & Humanities,World Literature,Harvard University (edX),https://www.edx.org/course/masterpieces-of-world-literature,Survey of major works of world literature.,12 weeks (4-6 hrs/week),Beginner,,Never
Arts & Humanities,World Mythology,University of Pennsylvania (Coursera),https://www.coursera.org/learn/mythology,Study of world mythologies and cultural narratives.,6 weeks (3-4 hrs/week),Beginner,,Never
Biomedical Engineering,Biomechanics,MIT OpenCourseWare,https://ocw.mit.edu/courses/biological-engineering/20-310j-molecular-cellular-and-tissue-biomechanics-spring-2015/,Mechanical principles in biological systems.,Self-paced,Intermediate,"Mechanics, Biology",Never
Biomedical Engineering,Biomedical Instrumentation,NPTEL (IIT Madras),https://nptel.ac.in/courses/117106088,Medical instruments and measurement systems.,Self-paced,Intermediate,Electronics,Never
Biomedical Engineering,Medical Imaging,NPTEL (IIT Kharagpur),https://nptel.ac.in/courses/117105084,Medical imaging technologies and processing.,Self-paced,Advanced,Signal Processing,Never
Biomedical Engineering,Tissue Engineering,MIT OpenCourseWare,https://ocw.mit.edu/courses/biological-engineering/20-441j-biomaterials-tissue-interactions-fall-2009/,Tissue engineering and regenerative medicine.,Self-paced,Advanced,Cell Biology,Never
Business & Management,Business Communication,Coursera,https://www.coursera.org/specializations/business-communication,Effective business communication strategies.,3 months (4-6 hrs/week),Beginner,,Never
Business & Management,Entrepreneurship,Wharton School (Coursera),https://www.coursera.org/learn/entrepreneurship,Entrepreneurship specialization covering startup strategies and funding.,4 months (4-6 hrs/week),Intermediate,,Never
Business & Management,Financial Accounting Fundamentals,University of Pennsylvania (Coursera),https://www.coursera.org/learn/wharton-accounting,Financial accounting principles and practices.,4 weeks (8-10 hrs/week),Beginner,,Never
Business & Management,Google Project Management Professional Certificate,Google (Coursera),https://www.coursera.org/professional-certificates/google-project-management,"Comprehensive project management training covering Agile, Scrum, and project execution.",6 months (10 hrs/week),Beginner,,Never
Business & Management,Introduction to Project Management,University of Adelaide (edX),https://www.edx.org/course/introduction-to-project-management,"Project management fundamentals, tools, and techniques.",6 weeks (4-6 hrs/week),Beginner,,Never
Business & Management,Marketing Management,University of Virginia (Coursera),https://www.coursera.org/learn/marketing-management,Marketing management principles and strategies.,4 weeks (4-6 hrs/week),Intermediate,,Never
Business & Management,Negotiation Skills,University of Michigan (Coursera),https://www.coursera.org/learn/negotiation-skills,Negotiation strategies and techniques.,4 weeks (2-4 hrs/week),Beginner,,Never
Business & Management,Supply Chain Management,MIT (edX),https://www.edx.org/course/supply-chain-management,Supply chain management principles and strategies.,8 weeks (8-10 hrs/week),Intermediate,,Never
Chemical Engineering,Biochemical Engineering,MIT OpenCourseWare,https://ocw.mit.edu/courses/chemical-engineering/10-445-separation-processes-for-biochemical-products-summer-2005/,Bioprocess engineering and biochemical separations.,Self-paced,Advanced,Biochemistry,Never
Chemical Engineering,Chemical Reaction Engineering,MIT OpenCourseWare,https://ocw.mit.edu/courses/chemical-engineering/10-37-chemical-and-biological-reaction-engineering-spring-2007/,Chemical kinetics and reactor design.,Self-paced,Intermediate,Chemistry,Never
Chemical Engineering,Chemical Thermodynamics,NPTEL,https://nptel.ac.in/courses/103107127,Thermodynamics of chemical systems.,Self-paced,Intermediate,Chemistry,Never
Chemical Engineering,Nanotechnology,Coursera,https://www.coursera.org/learn/nanotechnology,Engineering at the nanoscale.,6 weeks,Advanced,Chemistry,Never
Chemical Engineering,Polymer Engineering,NPTEL (IIT Delhi),https://nptel.ac.in/courses/103102015,Polymer science and engineering principles.,Self-paced,Intermediate,Organic Chemistry,Never
Chemical Engineering,Process Control,NPTEL (IIT Kharagpur),https://nptel.ac.in/courses/103105127,Control systems in chemical processes.,Self-paced,Advanced,Process Dynamics,Never
Chemical Engineering,Process Equipment Design,NPTEL (IIT Guwahati),https://nptel.ac.in/courses/103106123,Design of chemical process equipment and vessels.,Self-paced,Advanced,Unit Operations,Never
Chemical Engineering,Reaction Engineering,NPTEL (IIT Madras),https://nptel.ac.in/courses/103106108,Chemical reaction kinetics and reactor design.,Self-paced,Intermediate,Physical Chemistry,Never
Chemical Engineering,Transport Phenomena,MIT OpenCourseWare,https://ocw.mit.edu/courses/chemical-engineering/10-302-transport-processes-fall-2004/,"Mass, momentum, and energy transport in chemical systems.",Self-paced,Intermediate,"Fluid Mechanics, Heat Transfer",Never
Civil & Structural Engineering,BIM Fundamentals for Engineers,Coursera/Autodesk,https://www.coursera.org/learn/bim-fundamentals,Building Information Modeling basics for civil and structural engineers,4 weeks,Beginner,,
Civil & Structural Engineering,Building Materials and Construction,NPTEL (IIT Madras),https://nptel.ac.in/courses/105106144,Properties of building materials and construction methods.,Self-paced,Beginner,,Never
Civil & Structural Engineering,Construction Management,Coursera (Columbia University),https://www.coursera.org/learn/construction-management,Principles of construction project management.,5 weeks (3-5 hrs/week),Beginner,,Never
Civil & Structural Engineering,Construction Safety Management,OSHA,https://www.osha.gov/training/outreach/construction,Safety practices and regulations for construction sites,10 hours,Beginner,,
Civil & Structural Engineering,Geotechnical Engineering,NPTEL (IIT Bombay),https://nptel.ac.in/courses/105101201,Soil mechanics and geotechnical engineering fundamentals.,Self-paced,Intermediate,Basic Civil Engineering,Never
Civil & Structural Engineering,Introduction to Bridge Inspection,FHWA (National Highway Institute),https://www.fhwa.dot.gov/bridge/inspection/,Bridge inspection techniques and safety,24 hours,Intermediate,,
Civil & Structural Engineering,Introduction to Finite Element Analysis,NPTEL,https://nptel.ac.in/courses/105106051,Basics of finite element methods for structural analysis,8 weeks,Advanced,,
Civil & Structural Engineering,Introduction to GIS for Civil Engineers,Esri Academy,https://www.esri.com/training/catalog/57630435851d31e02a43f193/introduction-to-gis/,GIS concepts and applications in civil engineering,6 hours,Beginner,,
