Category,Certification_Name,Provider,URL,Description,Duration,Level,Prerequisites,Expiration
Cloud Computing (Cloud Security),Imperva Cloud Security,Imperva,https://www.imperva.com/learn/data-security/cloud-security/,Cloud data security concepts and implementation,2 hours,Beginner,,
Cloud Computing (Cloud Security),Netskope Cloud Security,Netskope,https://www.netskope.com/resources,Cloud access security broker (CASB) concepts,3 hours,Intermediate,Basic security knowledge,
Cloud Computing (Cloud Security),Prisma Cloud Security,Palo Alto Networks,https://www.paloaltonetworks.com/prisma/cloud,Cloud native security platform fundamentals,4 hours,Intermediate,Basic cloud knowledge,
Cloud Computing (Cloud Security),Qualys Cloud Security,Qualys,https://www.qualys.com/training/,Cloud security assessment and compliance,3 hours,Intermediate,Basic security knowledge,
Cloud Computing (Cloud Security),SailPoint Cloud Security,SailPoint,https://www.sailpoint.com/identity-library/cloud-security/,Identity governance for cloud security,3 hours,Intermediate,Basic IAM knowledge,
Cloud Computing (Cloud Security),Thales Cloud Security,Thales,https://cpl.thalesgroup.com/cloud-security,Data protection and encryption for cloud security,3 hours,Intermediate,Basic cryptography knowledge,
Cloud Computing (Cloud Security),Venafi Cloud Security,Venafi,https://venafi.com/cloud-security/,Machine identity management for cloud security,3 hours,Intermediate,Basic security knowledge,
Cloud Computing (Cloud Security),Zscaler Cloud Security,Zscaler,https://www.zscaler.com/resources/security-terms-glossary/what-is-cloud-security,Zero Trust cloud security concepts and implementation,3 hours,Intermediate,Basic security knowledge,
Cybersecurity & Information Security,AWS Security Fundamentals,Amazon Web Services,https://explore.skillbuilder.aws/learn/course/external/view/elearning/48/aws-security-fundamentals,"AWS security services, features, and best practices.",4 hours,Beginner,,Never
Cybersecurity & Information Security,Application Security Fundamentals,OWASP,https://owasp.org/www-project-application-security-curriculum/,Web application security concepts and best practices.,10 hours,Intermediate,Basic web development,Never
Cybersecurity & Information Security,Cyber Threat Intelligence,Cybrary,https://www.cybrary.it/course/cyber-threat-intelligence,Threat intelligence concepts and methodologies.,6 hours,Intermediate,Basic security knowledge,Never
Cybersecurity & Information Security,IBM Cybersecurity Analyst Professional Certificate,IBM (Coursera),https://www.coursera.org/professional-certificates/ibm-cybersecurity-analyst,"Comprehensive cybersecurity training including incident response, threat intelligence, and security tools.",8 months (10 hrs/week),Intermediate,Basic IT knowledge,Never
Cybersecurity & Information Security,Information Security Certification,freeCodeCamp,https://www.freecodecamp.org/learn/information-security/,"Information security concepts, penetration testing, and Python for security.",300 hours,Intermediate,Basic programming,Never
Cybersecurity & Information Security,IoT Security Fundamentals,IEEE,https://www.ieee.org/education/online-learning.html,Security concepts for Internet of Things devices.,6 hours,Intermediate,Basic IoT knowledge,Never
Cybersecurity & Information Security,Mobile Security Fundamentals,Cybrary,https://www.cybrary.it/course/mobile-security-fundamentals,Mobile device and application security concepts.,4 hours,Beginner,,Never
Cybersecurity & Information Security,NSE 1 Network Security Associate,Fortinet,https://training.fortinet.com/local/staticpage/view.php?page=nse_1,Network security concepts and threat landscape awareness.,4 hours,Beginner,,Never
Cybersecurity & Information Security,Security Awareness Training,SANS,https://www.sans.org/security-awareness-training/resources/,Basic security awareness for end users.,2 hours,Beginner,,Never
Cybersecurity & Information Security,"Security, Compliance, and Identity Fundamentals (SC-900)",Microsoft Learn,https://learn.microsoft.com/en-us/certifications/security-compliance-and-identity-fundamentals/,"Microsoft security, compliance, and identity solutions.",10 hours,Beginner,,Never
Data Science & Analytics,Applied Data Science with Python Specialization,University of Michigan (Coursera),https://www.coursera.org/specializations/data-science-python,"Python programming, data manipulation, machine learning, text mining, social network analysis, and visualization.",5 months (7 hrs/week),Intermediate,Python basics,Never
Data Science & Analytics,Data Analysis and Visualization Foundations,IBM (Coursera),https://www.coursera.org/specializations/data-analysis-visualization-foundations,Fundamentals of data analysis and visualization using various tools and techniques.,3 months (4 hrs/week),Beginner,,Never
Data Science & Analytics,Data Science Math Skills,Duke University (Coursera),https://www.coursera.org/learn/datasciencemathskills,Essential mathematical concepts for data science and machine learning.,4 weeks (2-3 hrs/week),Beginner,Basic math,Never
Data Science & Analytics,Data Science Methodology,IBM (Coursera),https://www.coursera.org/learn/data-science-methodology,Fundamental methodologies and practices in data science projects.,3 weeks (2-3 hrs/week),Beginner,,Never
Data Science & Analytics,Data Science: Foundations using R Specialization,Johns Hopkins University (Coursera),https://www.coursera.org/specializations/data-science-foundations-r,"Foundation in R programming, statistical inference, regression models, and practical data science tools.",4 months (6 hrs/week),Intermediate,Basic programming knowledge,Never
Data Science & Analytics,Microsoft Power BI Data Analyst,Microsoft Learn,https://learn.microsoft.com/en-us/certifications/power-bi-data-analyst-associate/,"Data preparation, visualization, and analysis using Microsoft Power BI.",40-50 hours,Intermediate,Basic data concepts,Never
Data Science & Analytics,Statistics and Probability,Khan Academy,https://www.khanacademy.org/math/statistics-probability,Comprehensive coverage of statistics and probability concepts for data science.,Self-paced,Beginner,,Never
Design & Creative,Design Thinking for Innovation,University of Virginia (Coursera),https://www.coursera.org/learn/design-thinking-innovation,Design thinking approach to innovation and problem-solving.,4 weeks (2-3 hrs/week),Beginner,,Never
Design & Creative,Design for Accessibility,Google Web Fundamentals,https://web.dev/accessibility/,Accessible design principles and practices.,4-5 hours,Intermediate,Basic design knowledge,Never
Design & Creative,Figma Fundamentals,Figma,https://help.figma.com/hc/en-us/categories/360002042553-Figma-basics,Design and prototyping with Figma platform.,4-5 hours,Beginner,,Never
Design & Creative,Game Design Basics,Michigan State University (Coursera),https://www.coursera.org/learn/game-design,Game design principles and concepts.,4 weeks (4-6 hrs/week),Beginner,,Never
Design & Creative,Google UX Design Professional Certificate,Google (Coursera),https://www.coursera.org/professional-certificates/google-ux-design,"Comprehensive UX design training covering design thinking, wireframing, prototyping, and user research.",6 months (10 hrs/week),Beginner,,Never
Design & Creative,Sketch Basics,Sketch,https://www.sketch.com/learn/,Digital design with Sketch tools and features.,3-4 hours,Beginner,,Never
Design & Creative,Typography Fundamentals,California Institute of the Arts (Coursera),https://www.coursera.org/learn/typography,Typography principles and practices in design.,4 weeks (2-3 hrs/week),Beginner,,Never
Design & Creative,Visual Design,Gymnasium,https://thegymnasium.com/courses/GYM/107/0/about,Visual design principles and techniques.,4-6 hours,Beginner,,Never
Design & Creative,Web Design for Everybody,University of Michigan (Coursera),https://www.coursera.org/specializations/web-design,"Web design fundamentals including HTML, CSS, and responsive design.",6 months (4-6 hrs/week),Beginner,,Never
Digital Marketing & Social Media,Content Marketing Certification,HubSpot Academy,https://academy.hubspot.com/courses/content-marketing,"Content marketing strategy, creation, and promotion.",6 hours,Beginner,,2 years
Digital Marketing & Social Media,Digital Advertising,Facebook Blueprint,https://www.facebookblueprint.com/,Digital advertising across Meta platforms.,5-6 hours,Beginner,,Never
Digital Marketing & Social Media,Digital Marketing Strategy,edX,https://www.edx.org/course/digital-marketing-strategy,Strategic approach to digital marketing and campaign planning.,6 weeks (4-6 hrs/week),Intermediate,,Never
Digital Marketing & Social Media,Digital Sales and Marketing,LinkedIn Learning,https://www.linkedin.com/learning/paths/become-a-digital-marketing-specialist,Digital sales strategies and marketing alignment.,20 hours,Intermediate,,Never
Digital Marketing & Social Media,Fundamentals of Digital Marketing,Google Digital Garage,https://learndigital.withgoogle.com/digitalgarage/course/digital-marketing,"Complete digital marketing course covering SEO, SEM, social media, and content marketing.",40 hours,Beginner,,Never
Digital Marketing & Social Media,Google Digital Marketing & E-commerce Certificate,Google (Coursera),https://www.coursera.org/professional-certificates/google-digital-marketing-ecommerce,"Comprehensive digital marketing and e-commerce skills including SEO, SEM, analytics, and online store management.",6 months (10 hrs/week),Beginner,,Never
Digital Marketing & Social Media,Hootsuite Social Marketing,Hootsuite Academy,https://education.hootsuite.com/courses/social-marketing-education,Social media management and marketing strategies.,6 hours,Beginner,,Never
Digital Marketing & Social Media,HubSpot Inbound Marketing Certification,HubSpot Academy,https://academy.hubspot.com/courses/inbound-marketing,"Inbound marketing methodology, content strategy, and lead generation.",4 hours,Beginner,,2 years
Digital Marketing & Social Media,SEMrush Academy SEO Fundamentals,SEMrush,https://www.semrush.com/academy/,"SEO fundamentals, keyword research, and technical optimization.",4 hours,Beginner,,Never
Digital Marketing & Social Media,Social Media Marketing Specialization,Northwestern University (Coursera),https://www.coursera.org/specializations/social-media-marketing,Comprehensive social media strategy and marketing.,5 months (3 hrs/week),Intermediate,,Never
Digital Marketing & Social Media,YouTube Content Strategy Certification,YouTube Creator Academy,https://creatoracademy.youtube.com/,"YouTube content creation, optimization, and channel growth strategies.",8-10 hours,Beginner,,Never
Education & Teaching,Assessment in Higher Education,edX,https://www.edx.org/learn/education,Assessment strategies and practices in higher education.,6 weeks (3-4 hrs/week),Intermediate,Teaching experience,Never
Education & Teaching,Curriculum Development,Commonwealth of Learning,https://www.col.org/resources,Principles and practices of curriculum development.,20 hours,Intermediate,Teaching experience,Never
Education & Teaching,Digital Assessment Tools,European Schoolnet Academy,https://www.europeanschoolnetacademy.eu/,Using digital tools for assessment.,6 weeks (2-3 hrs/week),Intermediate,Basic tech skills,Never
Education & Teaching,Foundations of Teaching for Learning,Commonwealth Education Trust (Coursera),https://www.coursera.org/learn/teaching-learning,Core principles of effective teaching and learning strategies.,6 weeks (4-5 hrs/week),Beginner,,Never
Education & Teaching,Google Certified Educator Level 1,Google for Education,https://edu.google.com/teacher-center/certifications/educator-level1/,Using Google tools for teaching and learning.,10-12 hours,Beginner,,3 years
Education & Teaching,Inclusive Teaching,CAST,http://www.cast.org/our-work/professional-learning,Universal Design for Learning principles.,10 hours,Intermediate,,Never
Education & Teaching,Microsoft Innovative Educator,Microsoft Education,https://education.microsoft.com/en-us,Microsoft tools and technologies in education.,8-10 hours,Beginner,,2 years
Education & Teaching,Student Assessment Strategies,Australian Council for Educational Research,https://www.acer.org/professional-learning,Effective student assessment methods.,12 hours,Intermediate,Teaching experience,Never
Electrical & Electronics Engineering,Circuits and Electronics,MIT OpenCourseWare,https://ocw.mit.edu/courses/electrical-engineering-and-computer-science/6-002-circuits-and-electronics-spring-2007/,Basic circuit analysis and electronic components.,Self-paced,Beginner,"Physics, Calculus",Never
Electrical & Electronics Engineering,Control Systems,NPTEL (IIT Kharagpur),https://nptel.ac.in/courses/108105062,Control theory and feedback systems.,Self-paced,Intermediate,"Signals, Calculus",Never
Electrical & Electronics Engineering,Digital Systems,MIT OpenCourseWare,https://ocw.mit.edu/courses/electrical-engineering-and-computer-science/6-004-computation-structures-spring-2017/,"Digital logic, computation, and system design.",Self-paced,Intermediate,"Circuits, Programming",Never
Electrical & Electronics Engineering,Electromagnetics,MIT OpenCourseWare,https://ocw.mit.edu/courses/electrical-engineering-and-computer-science/6-013-electromagnetics-and-applications-fall-2005/,Electromagnetic fields and applications.,Self-paced,Intermediate,"Physics, Calculus",Never
Electrical & Electronics Engineering,Introduction to Electrical Engineering,MIT OpenCourseWare,https://ocw.mit.edu/courses/electrical-engineering-and-computer-science/,Fundamentals of electrical engineering principles and systems.,Self-paced,Beginner,,Never
Electrical & Electronics Engineering,Microelectronics,MIT OpenCourseWare,https://ocw.mit.edu/courses/electrical-engineering-and-computer-science/6-012-microelectronic-devices-and-circuits-fall-2009/,Microelectronic devices and circuit design.,Self-paced,Intermediate,"Circuits, Physics",Never
Electrical & Electronics Engineering,Power Electronics,Coursera (University of Colorado Boulder),https://www.coursera.org/learn/power-electronics,Power electronics and energy conversion.,6 weeks (4-6 hrs/week),Intermediate,"Circuits, Physics",Never
Electrical & Electronics Engineering,Signals and Systems,MIT OpenCourseWare,https://ocw.mit.edu/courses/electrical-engineering-and-computer-science/6-003-signals-and-systems-fall-2011/,Signal processing and system analysis.,Self-paced,Intermediate,"Circuits, Calculus",Never
Electrical Engineering,Embedded Systems,edX,https://www.edx.org/learn/embedded-systems,Embedded system design and programming.,8 weeks,Advanced,Programming,Never
Electrical Engineering,Power Electronics,NPTEL,https://nptel.ac.in/courses/108105066,Power electronic devices and circuits.,Self-paced,Intermediate,Electronics,Never
Electrical Engineering,Renewable Energy Systems,Coursera,https://www.coursera.org/learn/renewable-energy,Renewable energy technologies and systems.,6 weeks,Intermediate,Physics,Never
Electrical Engineering,VLSI Design,NPTEL,https://nptel.ac.in/courses/117106093,VLSI circuit design and fabrication.,Self-paced,Advanced,Electronics,Never
Emerging Technologies Engineering,Bioinformatics Engineering,MIT OpenCourseWare,https://ocw.mit.edu/courses/biological-engineering/20-320-analysis-of-biomolecular-and-cellular-systems-fall-2012/,Computational biology and bioinformatics.,Self-paced,Advanced,"Biology, Programming",Never
Emerging Technologies Engineering,Blockchain Engineering,IBM,https://www.ibm.com/training/blockchain,Blockchain technology and applications.,Self-paced,Intermediate,Programming,Never
Emerging Technologies Engineering,Extended Reality (XR),Unity,https://learn.unity.com/,AR/VR/MR development.,Self-paced,Intermediate,Programming,Never
Energy Engineering,Energy Efficiency Engineering,ASHRAE,https://www.ashrae.org/professional-development/learning-portal,Energy efficiency and conservation.,Self-paced,Intermediate,,Never
Energy Engineering,Nuclear Engineering Basics,MIT OpenCourseWare,https://ocw.mit.edu/courses/nuclear-engineering/22-01-introduction-to-nuclear-engineering-and-ionizing-radiation-fall-2016/,Nuclear engineering principles.,Self-paced,Intermediate,Physics,Never
Energy Engineering,Power Systems Engineering,NPTEL,https://nptel.ac.in/courses/108105067,Electrical power systems and grid.,Self-paced,Intermediate,Electrical Engineering,Never
Energy Engineering,Smart Grid Technology,IEEE,https://www.ieee.org/education/topics/smart-grid.html,Smart grid systems and technology.,Self-paced,Advanced,Power Systems,Never
Energy Engineering,Wind Energy Engineering,Coursera,https://www.coursera.org/learn/wind-energy,Wind power systems and technology.,6 weeks,Intermediate,Physics,Never
Engineering Design,Engineering Drawing Standards,ASME,https://www.asme.org/learning-development,Technical drawing and standards.,Self-paced,Intermediate,,Never
Engineering Design,Parametric Modeling,PTC,https://www.ptc.com/en/education,Parametric design techniques.,Self-paced,Intermediate,CAD,Never
Engineering Management,Engineering Leadership,Coursera,https://www.coursera.org/learn/engineering-leadership,Leadership skills for engineers.,6 weeks,Intermediate,,Never
Engineering Management,Engineering Safety Management,OSHA,https://www.osha.gov/training,Safety management in engineering.,Self-paced,Intermediate,,Never
Environment & Sustainability,Climate Change: The Science and Global Impact,"University of California, San Diego (Coursera)",https://www.coursera.org/learn/global-warming,The science behind climate change and its global impacts.,6 weeks (2-4 hrs/week),Beginner,,Never
Environment & Sustainability,Environmental Ethics,Coursera,https://www.coursera.org/courses?query=environmental%20ethics,Ethical considerations in environmental decision-making.,Varies,Beginner,,Never
Environment & Sustainability,Introduction to Sustainable Development,University of Michigan (Coursera),https://www.coursera.org/learn/sustainable-development,Fundamentals of sustainable development and environmental issues.,6 weeks (2-4 hrs/week),Beginner,,Never
Environment & Sustainability,Oceanography,National Geographic,https://www.nationalgeographic.org/education/,Oceanography and marine ecosystems.,Varies,Beginner,,Never
Environment & Sustainability,Sustainable Agriculture,Wageningen University (edX),https://www.edx.org/course/sustainable-agriculture,Sustainable agriculture practices and food systems.,7 weeks (4-6 hrs/week),Beginner,,Never
Environmental Engineering,Air Pollution Control,NPTEL (IIT Delhi),https://nptel.ac.in/courses/105102089,Air quality management and pollution control.,Self-paced,Intermediate,Basic Environmental Engineering,Never
Environmental Engineering,Environmental Engineering Fundamentals,MIT OpenCourseWare,https://ocw.mit.edu/courses/civil-and-environmental-engineering/1-018j-ecology-i-the-earth-system-fall-2009/,Basic principles of environmental engineering.,Self-paced,Beginner,,Never
Environmental Engineering,Environmental Systems Modeling,MIT OpenCourseWare,https://ocw.mit.edu/courses/civil-and-environmental-engineering/1-020-ecology-ii-engineering-for-sustainability-spring-2008/,Modeling environmental systems and processes.,Self-paced,Advanced,"Mathematics, Programming",Never
Environmental Engineering,Green Building Design,USGBC,https://www.usgbc.org/education,Sustainable building design principles.,Self-paced,Intermediate,,Never
Environmental Engineering,Hazardous Waste Treatment,NPTEL (IIT Bombay),https://nptel.ac.in/courses/105101005,Management and treatment of hazardous waste.,Self-paced,Advanced,Environmental Chemistry,Never
Environmental Engineering,Solid Waste Management,NPTEL (IIT Kharagpur),https://nptel.ac.in/courses/105105048,Solid waste treatment and disposal methods.,Self-paced,Intermediate,,Never
Environmental Engineering,Water Treatment Engineering,NPTEL (IIT Madras),https://nptel.ac.in/courses/105106119,Water and wastewater treatment processes.,Self-paced,Intermediate,Chemistry,Never
Finance & Economics,Economics of Money and Banking,Columbia University (Coursera),https://www.coursera.org/learn/money-banking,"Core concepts in money, banking, and financial systems.",13 weeks (3-5 hrs/week),Intermediate,,Never
Finance & Economics,Financial Accounting Fundamentals,University of Virginia (Coursera),https://www.coursera.org/learn/uva-darden-financial-accounting,Financial accounting principles and practices.,4 weeks (4-6 hrs/week),Beginner,,Never
Finance & Economics,Financial Engineering and Risk Management,Columbia University (Coursera),https://www.coursera.org/learn/financial-engineering-1,"Risk management, derivatives, and financial engineering.",7 weeks (5-7 hrs/week),Intermediate,Basic finance knowledge,Never
Finance & Economics,Financial Markets,Yale University (Coursera),https://www.coursera.org/learn/financial-markets-global,"Introduction to financial markets, risk management, and behavioral finance.",7 weeks (5-7 hrs/week),Beginner,,Never
Finance & Economics,Introduction to Blockchain,University at Buffalo (Coursera),https://www.coursera.org/learn/blockchain-basics,Blockchain technology and its applications in finance.,4 weeks (3-4 hrs/week),Beginner,,Never
Finance & Economics,Introduction to Corporate Finance,University of Pennsylvania (Coursera),https://www.coursera.org/learn/wharton-finance,Corporate finance fundamentals and valuation.,4 weeks (5-6 hrs/week),Beginner,,Never
Finance & Economics,Introduction to Economics,MIT OpenCourseWare,https://ocw.mit.edu/courses/economics/,Basic economic principles and theories.,Self-paced,Beginner,,Never
Finance & Economics,Investment Management,University of Geneva (Coursera),https://www.coursera.org/learn/investment-management,"Investment strategies, portfolio management, and asset allocation.",7 weeks (4-6 hrs/week),Intermediate,Basic finance knowledge,Never
Finance & Economics,Principles of Microeconomics,University of Illinois (Coursera),https://www.coursera.org/learn/microeconomics,Microeconomic principles and market analysis.,8 weeks (3-5 hrs/week),Beginner,,Never
Healthcare & Medical,COVID-19 Contact Tracing,Johns Hopkins University (Coursera),https://www.coursera.org/learn/covid-19-contact-tracing,"Contact tracing methodology, ethics, and best practices for COVID-19.",7 hours,Beginner,,Never
Healthcare & Medical,Emergency Preparedness,CDC TRAIN,https://www.train.org/cdctrain/welcome,Emergency preparedness in healthcare settings.,6 hours,Beginner,,Never
Healthcare & Medical,First Aid Basics,American Red Cross,https://www.redcross.org/take-a-class/first-aid/first-aid-training/first-aid-online,Basic first aid principles and emergency response.,2-3 hours,Beginner,,2 years
Healthcare & Medical,Healthcare Quality Improvement,Institute for Healthcare Improvement,http://www.ihi.org/education/IHIOpenSchool,Healthcare quality improvement principles and methods.,8 hours,Intermediate,Healthcare experience,Never
Healthcare & Medical,Psychological First Aid,Johns Hopkins University (Coursera),https://www.coursera.org/learn/psychological-first-aid,Basic psychological first aid principles and techniques.,6 hours,Beginner,,Never
Industrial & Systems Engineering,Ergonomics and Human Factors,NPTEL (IIT Bombay),https://nptel.ac.in/courses/112101097,Human factors engineering and workplace design.,Self-paced,Intermediate,,Never
Industrial & Systems Engineering,Introduction to Industrial Engineering,NPTEL (IIT Kharagpur),https://nptel.ac.in/courses/112105171,Fundamentals of industrial engineering and systems.,Self-paced,Beginner,,Never
Industrial & Systems Engineering,Operations Research,MIT OpenCourseWare,https://ocw.mit.edu/courses/sloan-school-of-management/15-053-optimization-methods-in-management-science-spring-2013/,Mathematical optimization and operations research.,Self-paced,Intermediate,Linear Algebra,Never
Industrial & Systems Engineering,Production Planning and Control,NPTEL (IIT Roorkee),https://nptel.ac.in/courses/112107142,Production systems and inventory control.,Self-paced,Intermediate,Basic IE,Never
Industrial & Systems Engineering,Project Management for Engineers,MIT OpenCourseWare,https://ocw.mit.edu/courses/civil-and-environmental-engineering/1-040-project-management-spring-2009/,Project management principles and techniques.,Self-paced,Intermediate,,Never
Industrial & Systems Engineering,Simulation Modeling,NPTEL (IIT Delhi),https://nptel.ac.in/courses/112107241,System simulation and modeling techniques.,Self-paced,Advanced,"Statistics, Programming",Never
Industrial & Systems Engineering,Systems Engineering Fundamentals,MIT OpenCourseWare,https://ocw.mit.edu/courses/engineering-systems-division/esd-33-systems-engineering-summer-2010/,Systems thinking and engineering methodology.,Self-paced,Intermediate,,Never
IoT Engineering,Industrial IoT,Coursera,https://www.coursera.org/learn/industrial-iot-markets-security,IoT applications in industrial settings.,6 weeks,Advanced,IoT Basics,Never
IoT Engineering,IoT Cloud Platforms,Oracle University,https://education.oracle.com/learning-explorer/learning-path/35644,Cloud platforms for IoT solutions.,Self-paced,Intermediate,Cloud Basics,Never
IoT Engineering,IoT Protocols,Microsoft Learn,https://learn.microsoft.com/en-us/training/paths/introduction-to-azure-iot/,Communication protocols in IoT.,8 hours,Intermediate,Networking,Never
IoT Engineering,IoT Security,IBM,https://www.ibm.com/training/iot,Security in IoT systems and devices.,Self-paced,Intermediate,Basic IoT,Never
Language Learning,Dutch Language Course,Nederlandse Taalunie,http://www.taalunie.org/,Dutch language basics and cultural context.,8 weeks (3-4 hrs/week),Beginner,,Never
Language Learning,English for Career Development,University of Pennsylvania (Coursera),https://www.coursera.org/learn/business-english,Business English and professional communication.,5 weeks (3-4 hrs/week),Intermediate,Basic English,Never
